<?xml version="1.0" encoding="UTF-8"?><!-- edited with XMLSPY v2004 rel. 3 U (http://www.xmlspy.com) by blank (blank) --><!--DTD generated by XMLSPY v2004 rel. 3 U (http://www.xmlspy.com)--><!ELEMENT articles (article-ref*)><!ELEMENT header-item (#PCDATA)><!ATTLIST header-item	name CDATA #REQUIRED	value CDATA #IMPLIED	xmlns CDATA #FIXED "http://www.iarchives.com/schema/2002/export"><!ELEMENT nodes (n*)><!ELEMENT page (header-item*, articles?, nodes?)><!ATTLIST page	unit-href CDATA #REQUIRED	image-file CDATA #REQUIRED	predicted-word-accuracy CDATA #IMPLIED><!ELEMENT article-ref EMPTY><!ATTLIST article-ref	href CDATA #REQUIRED><!ELEMENT n (r*, o+)><!ATTLIST n	i CDATA #REQUIRED	n CDATA #IMPLIED><!ELEMENT r EMPTY><!ATTLIST r	l CDATA #REQUIRED	t CDATA #REQUIRED	r CDATA #REQUIRED	b CDATA #REQUIRED><!ELEMENT o (#PCDATA)><!ATTLIST o	p CDATA #IMPLIED	c CDATA #IMPLIED	f CDATA #IMPLIED>